{
  "type": "foxy.popup-profile",
  "author": "莫颜",

  "actions": {

    "DY.Home": { "type": "key", "key": "HOME" },
    "DY.End": { "type": "key", "key": "END" },
    "DY.undo": { "type": "app", "command": "undo" },
    "DY.redo": { "type": "app", "command": "redo" },

    "DY.huigai": { "type": "key", "key": "L", "meta": ["CTRL"] },
    "DY.SelectAll": { "type": "key", "key": "A", "meta": ["CTRL"] },
    "DY.Cut": { "type": "key", "key": "X", "meta": ["CTRL"] },
    "DY.Copy": { "type": "key", "key": "C", "meta": ["CTRL"] },
    "DY.Paste": { "type": "key", "key": "V", "meta": ["CTRL"] },

    "DY.BianMa": { "type": "key", "key": "ENTER", "meta": ["CTRL", "SHIFT"] },

    "DY.Layout_editor": { "type": "switch_layout", "layout": "editor" },
    "DY.Layout_editor2": { "type": "switch_layout", "layout": "editor2" },
    "DY.text_editor": { "type": "app", "command": "text_editor" },
    "DY.data_directory": { "type": "app", "command": "data_directory_list" }

  },

  "schemas": {
    "default": {

      "1":{ "normal": ["!", "1", "¹", "½", "⅓", "¼", "⅕", "⅙", "⅐", "⅛", "⅑", "⅒"] },
      "2":{ "normal": ["@", "2", "²", "⅖", "⅔"] },
      "3":{ "normal": ["#", "3", "³", "⅗", "¾", "⅜"] },
      "4":{ "normal": ["$", "4", "⁴", "⅘", "⅝", "⅚"] },
      "5":{ "normal": ["%", "5", "⁵", "⅝", "⅚"] },
      "6":{ "normal": ["^", "6", "⁶"] },
      "7":{ "normal": ["&", "7", "⁷", "⅞"] },
      "8":{ "normal": ["*", "8", "⁸"] },
      "9":{ "normal": ["(", "9", "⁹"] },
      "0":{ "normal": [")", "0", "∅", "ⁿ", "⁰"] },

      "q": { "normal": ["`", "q", "ɋ", "ꝗ", "ꝙ", "ʠ"], "shifted": ["`", "Q", "Ɋ", "Ꝗ", "Ꝙ", "Ɋ"] },
      "w": { "normal": ["~", "w", "ŵ", "ẃ", "ẁ", "ẘ", "ẅ", "ẇ", "ẉ"], "shifted": ["~", "W", "Ŵ", "Ẃ", "Ẁ", "Ẅ", "Ẇ"] },
      "e": { "normal": ["+", "e", "ê", "ë", "ē", "é", "ě", "è", "ė", "ę", "ẽ", "ĕ", "ẻ", "ế", "ề", "ể", "ễ", "ệ", "ẹ", "ḕ", "ḗ", "ḙ", "ḛ", "ḝ", "ə"], "shifted": ["+", "E", "Ê", "Ë", "Ē", "É", "Ě", "È", "Ė", "Ę", "Ẽ", "Ĕ", "Ẻ", "Ế", "Ề", "Ể", "Ễ", "Ệ", "Ẹ", "Ḕ", "Ḗ", "Ḙ", "Ḛ", "Ḝ", "Ə"] },
      "r": { "normal": ["-", "r", "ŕ", "ŗ", "ř", "ṙ", "ṛ", "ṝ", "ṟ", "ȑ", "ȓ", "ɍ"], "shifted": ["-", "R", "Ŕ", "Ŗ", "Ř", "Ṙ", "Ṛ", "Ṝ", "Ṟ", "Ȑ", "Ȓ", "Ɍ"] },
      "t": { "normal": ["=", "t", "ţ", "ť", "ț", "ṫ", "ṭ", "ṯ", "ṱ", "ẗ", "ƭ"], "shifted": ["=", "T", "Ţ", "Ť", "Ț", "Ṫ", "Ṭ", "Ṯ", "Ṱ", "T̈", "Ƭ"] },
      "y": { "normal": ["_", "y", "ý", "ÿ", "ŷ", "ỳ", "ỵ", "ỷ", "ỹ", "ȳ", "ẏ", "ƴ"], "shifted": ["_", "Y", "Ý", "Ÿ", "Ŷ", "Ỳ", "Ỵ", "Ỷ", "Ỹ", "Ȳ", "Ẏ", "Ƴ"] },
      "u": { "normal": ["{", "u", "û", "ü", "ū", "ú", "ǔ", "ù", "ũ", "ŭ", "ů", "ű", "ų", "ư", "ǖ", "ǘ", "ǚ", "ǜ", "ủ", "ụ", "ứ", "ừ", "ử", "ữ", "ự"], "shifted": ["{", "U", "Û", "Ü", "Ū", "Ú", "Ǔ", "Ù", "Ũ", "Ŭ", "Ů", "Ű", "Ų", "Ư", "Ǖ", "Ǘ", "Ǚ", "Ǜ", "Ủ", "Ụ", "Ứ", "Ừ", "Ử", "Ữ", "Ự"] },
      "i": { "normal": ["}", "i", "î", "ï", "ī", "í", "ǐ", "ì", "ĩ", "ĭ", "į", "ı", "ỉ", "ị", "ȋ", "ȉ", "ɨ"], "shifted": ["}", "I", "Î", "Ï", "Ī", "Í", "Ǐ", "Ì", "Ĩ", "Ĭ", "Į", "İ", "Ỉ", "Ị", "Ȋ", "Ȉ", "Ɨ"] },
      "o": { "normal": ["[", "o", "ô", "ö", "ō", "ó", "ǒ", "ò", "œ", "ø", "õ", "ŏ", "ő", "ơ", "ǫ", "ǭ", "ỏ", "ọ", "ố", "ồ", "ổ", "ỗ", "ộ", "ớ", "ờ", "ở", "ỡ", "ợ"], "shifted": ["[", "O", "Ô", "Ö", "Ō", "Ó", "Ǒ", "Ò", "Œ", "Ø", "Õ", "Ŏ", "Ő", "Ơ", "Ǫ", "Ǭ", "Ỏ", "Ọ", "Ố", "Ồ", "Ổ", "Ỗ", "Ộ", "Ớ", "Ờ", "Ở", "Ỡ", "Ợ"] },
      "p": { "normal": ["]", "p", "ṕ", "ṗ", "ƥ"], "shifted": ["]", "P", "Ṕ", "Ṗ", "Ƥ"] },
      "a": { "normal": ["\\", "a", "â", "ä", "ā", "á", "ǎ", "à", "æ", "ã", "å", "ą", "ă", "ȁ", "ȃ", "ạ", "ả", "ấ", "ầ", "ẩ", "ẫ", "ậ", "ắ", "ằ", "ẳ", "ẵ", "ặ"], "shifted": ["\\", "A", "Â", "Ä", "Ā", "Á", "Ǎ", "À", "Æ", "Ã", "Å", "Ą", "Ă", "Ȁ", "Ȃ", "Ạ", "Ả", "Ấ", "Ầ", "Ẩ", "Ẫ", "Ậ", "Ắ", "Ằ", "Ẳ", "Ẵ", "Ặ"] },
      "s": { "normal": ["|", "s", "ß", "ś", "ŝ", "š", "ş", "ș", "ṡ", "ṣ", "ṥ", "ṧ", "ṩ", "ẛ"], "shifted": ["|", "S", "ẞ", "Ś", "Ŝ", "Š", "Ş", "Ș", "Ṡ", "Ṣ", "Ṥ", "Ṧ", "Ṩ", "ẛ"] },
      "d": { "normal": ["×", "d", "ď", "đ", "ḓ", "ḋ", "ḍ", "ḏ", "ð", "ƌ", "ɖ"], "shifted": ["×", "D", "Ď", "Đ", "Ḓ", "Ḋ", "Ḍ", "Ḏ", "Ð", "Ƌ", "Ɖ"] },
      "f": { "normal": ["÷", "f", "ƒ", "ḟ"], "shifted": ["÷", "F", "Ƒ", "Ḟ"] },
      "g": { "normal": [ { "action": "DY.Home", "label": "行首" }, "←", "g", "ĝ", "ğ", "ġ", "ģ", "ǥ", "ḡ", "ɠ"], "shifted": [ { "action": "DY.Home", "label": "行首" }, "←", "G", "Ĝ", "Ğ", "Ġ", "Ģ", "Ǥ", "Ḡ", "Ɠ"] },
      "h": { "normal": [ { "action": "DY.End", "label": "行尾" }, "→", "h", "ĥ", "ħ", "ḣ", "ḥ", "ḧ", "ḩ", "ḫ", "ẖ", "ɦ"], "shifted": [ { "action": "DY.End", "label": "行尾" }, "→", "H", "Ĥ", "Ħ", "Ḣ", "Ḥ", "Ḧ", "Ḩ", "Ḫ", "ẖ", "ƕ"] },
      "j": { "normal": [ { "action": "DY.undo", "label": "撤销" }, "←", "j", "ĵ", "ǰ", "ȷ"], "shifted": [ { "action": "DY.undo", "label": "撤销" }, "←", "J", "Ĵ", "ǰ", "J"] },
      "k": { "normal": [ { "action": "DY.redo", "label": "重做" }, "→", "k", "ķ", "ǩ", "ḱ", "ḳ", "ḵ", "ʞ"], "shifted": [ { "action": "DY.redo", "label": "重做" }, "→", "K", "Ķ", "Ǩ", "Ḱ", "Ḳ", "Ḵ", "Ʞ"] },

      "l": { "normal": [ { "action": "DY.huigai", "label": "回改" }, "l", "ĺ", "ľ", "ļ", "ł", "ŀ", "ḽ", "ḷ", "ḹ", "ḻ", "ȴ"], "shifted": [ { "action": "DY.huigai", "label": "回改" }, "L", "Ĺ", "Ľ", "Ļ", "Ł", "Ŀ", "Ḽ", "Ḷ", "Ḹ", "Ḻ", "Ƚ"] },

      "z": { "normal": [ { "action": "DY.SelectAll", "label": "全选" }, "z", "ź", "ż", "ž", "ẑ", "ẓ", "ẕ", "ȥ", "ʐ"], "shifted": [ { "action": "DY.SelectAll", "label": "全选" }, "Z", "Ź", "Ż", "Ž", "Ẑ", "Ẓ", "Ẕ", "Ȥ", "Ƶ"] },
      "x": { "normal": [ { "action": "DY.Cut", "label": "剪切" }, "x", "ẋ", "ẍ", "ᶍ"], "shifted": [ { "action": "DY.Cut", "label": "剪切" }, "X", "Ẋ", "Ẍ", "Ꭓ"] },
      "c": { "normal": [ { "action": "DY.Copy", "label": "复制" }, "c", "ç", "ć", "ĉ", "č", "ċ", "ḉ", "ȼ"], "shifted": [ { "action": "DY.Copy", "label": "复制" }, "C", "Ç", "Ć", "Ĉ", "Č", "Ċ", "Ḉ", "Ȼ"] },
      "v": { "normal": [ { "action": "DY.Paste", "label": "粘贴" }, "v", "ṽ", "ṿ", "ʋ"], "shifted": [ { "action": "DY.Paste", "label": "粘贴" }, "V", "Ṽ", "Ṿ", "Ʋ"] },
      "b": { "normal": [ { "action": "DY.BianMa", "label": "编码" }, "b", "ƀ", "ƃ", "ƅ", "ḃ", "ḅ", "ḇ", "ɓ"], "shifted": [ { "action": "DY.BianMa", "label": "编码" }, "B", "Ƀ", "Ƃ", "Ƅ", "Ḃ", "Ḅ", "Ḇ", "Ɓ"] },
      "n": { "normal": [ { "action": "DY.text_editor", "label": "💠" }, { "action": "DY.Layout_editor", "label": "辑" }, { "action": "DY.Layout_editor2", "label": "编" }, "n", "ń", "ñ", "ņ", "ň", "ŉ", "ŋ", "ṅ", "ṇ", "ṉ", "ṋ", "ɲ"], "shifted": [ { "action": "DY.text_editor", "label": "💠" }, { "action": "DY.Layout_editor", "label": "辑" }, { "action": "DY.Layout_editor2", "label": "编" }, "N", "Ń", "Ñ", "Ņ", "Ň", "ŉ", "Ŋ", "Ṅ", "Ṇ", "Ṉ", "Ṋ", "Ɲ"] },
      "m": { "normal": [ { "action": "DY.data_directory", "label": "方案" }, "m", "ḿ", "ṁ", "ṃ", "ɱ"], "shifted": [ { "action": "DY.data_directory", "label": "方案" }, "M", "Ḿ", "Ṁ", "Ṃ", "Ɱ"] }
    }
  }
}
